{
  "$schema": "../../../../ui-schema.json",
  "type": "form",
  "title": "Security",
  "description": "A shared security scheme definition",
  "fields": {
    "securityDefinitions.?": {
      "type": "string",
      "title": "securityId"
    },
    "securityDefinitions.*.type": {
      "type": "select",
      "title": "Type",
      "options": ["basic", "apiKey", "oauth2"]
    },
    "securityDefinitions.*.description": {
      "type": "string",
      "title": "Description"
    },
    "securityDefinitions.*.name": {
      "type": "string",
      "title": "Name",
      "enabled": "type === 'apiKey'"
    },
    "securityDefinitions.*.in": {
      "type": "select",
      "title": "In",
      "options": ["query", "header"],
      "enabled": "type === 'apiKey'"
    },
    "securityDefinitions.*.flow": {
      "type": "select",
      "title": "Flow",
      "options": ["implicit", "password", "application", "accessCode"],
      "enabled": "type === 'oauth2'"
    },
    "securityDefinitions.*.authorizationUrl": {
      "type": "string",
      "title": "Authorization URL",
      "enabled": "type === 'oauth2' && (flow === 'implicit' || flow === 'accessCode')"
    },
    "securityDefinitions.*.tokenUrl": {
      "type": "string",
      "title": "Token URL",
      "enabled": "type === 'oauth2' && (flow === 'password' || flow === 'application' || flow === 'accessCode')"
    },
    "securityDefinitions.*.scopes": {
      "type": "object",
      "title": "Scopes",
      "default": "",
      "keys": {
        "type": "string",
        "title": "Name"
      },
      "values": {
        "type": "string",
        "title": "Description"
      },
      "enabled": "type === 'oauth2'"
    }
  }
}
