{
  "$schema": "../../../../ui-schema.json",
  "type": "form",
  "title": "HTTP Response",
  "description": "HTTP Response",
  "fields": {
    "paths.*.*.responses.?": {
      "type": "integer",
      "title": "Code",
      "custom": {
        "widget": "randomNumber"
      }
    },
    "paths.*.*.responses.*.description": {
      "type": "markdown",
      "title": "Description",
      "minLength": 4,
      "required": true
    },
    "paths.*.*.responses.*.content": {
      "type": "json",
      "title": "Content"
    },
    "paths.*.*.responses.*.headers": {
      "type": "array",
      "title": "Headers",
      "default": {
        "name": "",
        "type": "bug",
        "format": "json",
        "default": "",
        "description": ""
      },
      "items": {
        "title": "Header",
        "type": "form",
        "fields": {
          "name": {
            "type": "string",
            "title": "Name",
            "path": "name"
          },
          "type": {
            "type": "select",
            "title": "Type",
            "path": "type",
            "options": ["bug", "hot", "cold"]
          },
          "format": {
            "type": "select",
            "title": "Format",
            "path": "format",
            "options": ["json", "hot", "cold"]
          },
          "default": {
            "type": "string",
            "title": "Default",
            "path": "default"
          },
          "description": {
            "type": "string",
            "title": "Description",
            "path": "description"
          }
        }
      }
    },
    "paths.*.*.responses.*.schema": {
      "type": "multiselect",
      "title": "Schema",
      "custom": {
        "source": "models"
      }
    },
    "paths.*.*.responses.*.examples": {
      "type": "object",
      "title": "Examples",
      "default": {},
      "keys": {
        "type": "string",
        "title": "Name"
      },
      "values": {
        "type": "json",
        "title": "Content"
      }
    }
  }
}
